,title,overview,original_language,release_date,popularity,vote_count,vote_average
148,Cinderella,"When her father unexpectedly passes away, young Ella finds herself at the mercy of her cruel stepmother and her daughters. Never one to give up hope, Ella's fortunes begin to change after meeting a dashing stranger in the woods.",en,2015-03-12,31.815,5259,6.8
149,Harry Potter and the Deathly Hallows: Part 1,"Harry, Ron and Hermione walk away from their last year at Hogwarts to find and destroy the remaining Horcruxes, putting an end to Voldemort's bid for immortality. But with Harry's beloved Dumbledore dead and Voldemort's unscrupulous Death Eaters on the loose, the world is more dangerous than ever.",en,2010-10-17,47.999,12743,7.8
150,Mad Max: Fury Road,"An apocalyptic story set in the furthest reaches of our planet, in a stark desert landscape where humanity is broken, and most everyone is crazed fighting for the necessities of life. Within this world exist two rebels on the run who just might be able to restore order.",en,2015-05-13,40.952,16350,7.5
151,Blade Runner,"In the smog-choked dystopian Los Angeles of 2019, blade runner Rick Deckard is called out of retirement to terminate a quartet of replicants who have escaped to Earth seeking their creator for a way to extend their short life spans.",en,1982-06-25,44.819,9060,7.9
152,Titanic,"101-year-old Rose DeWitt Bukater tells the story of her life aboard the Titanic, 84 years later. A young Rose boards the ship with her mother and fiancé. Meanwhile, Jack Dawson and Fabrizio De Rossi win third-class tickets aboard the ship. Rose tells the whole story from Titanic's departure through to its death—on its first and last voyage—on April 15, 1912.",en,1997-11-18,35.661,16926,7.8
153,Back to the Future,"Eighties teenager Marty McFly is accidentally sent back in time to 1955, inadvertently disrupting his parents' first meeting and attracting his mother's romantic interest. Marty must repair the damage to history by rekindling his parents' romance and - with the help of his eccentric inventor friend Doc Brown - return to 1985.",en,1985-07-03,33.953,13076,8.3
154,Grease,"Australian good girl Sandy and greaser Danny fell in love over the summer. But when they unexpectedly discover they're now in the same high school, will they be able to rekindle their romance despite their eccentric friends?",en,1978-07-07,42.194,4736,7.4
155,Guardians of the Galaxy Vol. 2,The Guardians must fight to keep their newfound family together as they unravel the mysteries of Peter Quill's true parentage.,en,2017-04-19,38.806,14798,7.6
156,The Hobbit: An Unexpected Journey,"Bilbo Baggins, a hobbit enjoying his quiet life, is swept into an epic quest by Gandalf the Grey and thirteen dwarves who seek to reclaim their mountain home from Smaug, the dragon.",en,2012-11-26,32.29,13515,7.3
157,Star Wars: The Force Awakens,"Thirty years after defeating the Galactic Empire, Han Solo and his allies face a new threat from the evil Kylo Ren and his army of Stormtroopers.",en,2015-12-15,31.142,14419,7.4
158,The Godfather: Part II,"In the continuing saga of the Corleone crime family, a young Vito Corleone grows up in Sicily and in 1910s New York. In the 1950s, Michael Corleone attempts to expand the family business into Las Vegas, Hollywood and Cuba.",en,1974-12-20,34.08,7255,8.6
159,"The Chronicles of Narnia: The Lion, the Witch and the Wardrobe","Siblings Lucy, Edmund, Susan and Peter step through a magical wardrobe and find the land of Narnia. There, the they discover a charming, once peaceful kingdom that has been plunged into eternal winter by the evil White Witch, Jadis. Aided by the wise and magnificent lion, Aslan, the children lead Narnia into a spectacular, climactic battle to be free of the Witch's glacial powers forever.",en,2005-12-07,31.032,6918,7.1
160,Rambo: Last Blood,"After fighting his demons for decades, John Rambo now lives in peace on his family ranch in Arizona, but his rest is interrupted when Gabriela, the granddaughter of his housekeeper María, disappears after crossing the border into Mexico to meet her biological father. Rambo, who has become a true father figure for Gabriela over the years, undertakes a desperate and dangerous journey to find her.",en,2019-09-19,40.701,1774,6.2
161,Doctor Sleep,"Still irrevocably scarred by the trauma he endured as a child at the Overlook, Dan Torrance has fought to find some semblance of peace. But that peace is shattered when he encounters Abra, a courageous teenager with her own powerful extrasensory gift, known as the 'shine'. Instinctively recognising that Dan shares her power, Abra has sought him out, desperate for his help against the merciless Rose the Hat and her followers.",en,2019-10-30,35.058,1675,7.1
162,The Way Back,"A former basketball all-star, who has lost his wife and family foundation in a struggle with addiction attempts to regain his soul and salvation by becoming the coach of a disparate ethnically mixed high school basketball team at his alma mater.",en,2020-03-05,48.387,215,6.7
163,Forrest Gump,"A man with a low IQ has accomplished great things in his life and been present during significant historic events—in each case, far exceeding what anyone imagined he could do. But despite all he has achieved, his one true love eludes him.",en,1994-07-06,48.042,17966,8.4
164,Avengers: Age of Ultron,"When Tony Stark tries to jumpstart a dormant peacekeeping program, things go awry and Earth’s Mightiest Heroes are put to the ultimate test as the fate of the planet hangs in the balance. As the villainous Ultron emerges, it is up to The Avengers to stop him from enacting his terrible plans, and soon uneasy alliances and unexpected action pave the way for an epic and unique global adventure.",en,2015-04-22,35.984,15808,7.3
165,Beauty and the Beast,"Follow the adventures of Belle, a bright young woman who finds herself in the castle of a prince who's been turned into a mysterious beast. With the help of the castle's enchanted staff, Belle soon learns the most important lesson of all -- that true beauty comes from within.",en,1991-11-13,33.611,6826,7.7
166,Jurassic World,"Twenty-two years after the events of Jurassic Park, Isla Nublar now features a fully functioning dinosaur theme park, Jurassic World, as originally envisioned by John Hammond.",en,2015-06-06,30.966,15556,6.6